"ID","Status","Name","First Name","Last Name","Email","Phone","Address","Feedback Rating","Feedback Comment","Feedback Date","Feedback Requested","Feedback Published","Event ID","Event Name","Instructors","Canceled","Registered"
"5dca4b5dc7cc8b4fc41a627c","active","Andrew Marcus Webster","Andrew Marcus","Webster","andrew@wisdomat.work","+12057063371",,5,"Eye-opening sessions.  Going back to the absolute basics and weaving them into a much simpler implementation of the physics of organizations and work than other Agile (not so much) scaling approaches.  Dying to enroll clients in what would be possible for them if they adopted XScale.","2019-12-24 04:54:35","2019-12-23 14:00:01","2020-05-29 23:59:45","5dc3db1911ba82379fadc6ac","XBA US/CAN/ANZ - XSCALE Business Agility - Live Online Training Stream (NB ANZ course times are 9am-Noon Thursday and Saturday mornings AEDT)","Peter Merel",,"2019-11-12 17:04:18"
"5d986799eb39155c2fd9bf43","active","Dino Zafirakos","Dino","Zafirakos","dino@wayofkaizen.com","",,5,,"2019-11-04 02:55:23","2019-11-02 23:00:00",,"5cf0a00d5e4e88f9f804aecf","XBA EU/UK/ANZ - XSCALE Business Agility - Live Online Training Stream - (NB ANZ course times are 7-10pm Sunday and Saturday evenings AEST)","Peter Merel",,"2019-10-05 19:51:24"
"5ce77ff21a64e2245ed8402d","active","Mark Turner","Mark","Turner","markt@govirtual.com.au","0406795734",,5,"Great event Peter.\nDescaling at scale is a big boat to be sailing.\nNot everyone has the legs, large Genoa out.\nSpinnaker on a Carbon fibre pole.\nCrew only on this boat!","2019-07-21 22:17:58","2019-07-21 18:00:00",,"5ce616ce1a64e26944d82c81","Code Without Thrones Experiment 0","Peter Merel",,"2019-05-24 15:24:05"
"5e489e2fae9aebc257b579d9","active","Rich Stewart","Rich","Stewart","rich@sevawise.com","+1-850-212-1122",,5,"This course greatly increased my understanding of the different ways companies and individuals need to think about business agility, in accordance with the six XSCALE principles. For example, I learned how companies need to go beyond traditional cost accounting to maximize throughput. Overall, I learned how to have very different and impactful conversations with company leadership around what an agile transformation should include and how it can positively impact a company's bottom line and decision-making.","2020-04-04 05:34:26","2020-03-23 13:00:00","2020-05-29 23:57:57","5df77b6f435fe88d6bd04a50","XBA US/CAN/ANZ - XSCALE Business Agility - Live Online Training Stream (NB ANZ course times are 10am-1pm Thursday and Saturday AEDT)","Peter Merel",,"2020-02-16 12:43:15"
"5d2ef2fa88c9301553826f60","active","Rick Bates","Rick","Bates","rick@batesus.com","0408243978",,5,"Thanks Pete, Great fun and learning experience.  I can thoroughly recommend and will be attending the next one. Regards Rick","2019-07-21 22:24:43","2019-07-21 18:00:00",,"5ce616ce1a64e26944d82c81","Code Without Thrones Experiment 0","Peter Merel",,"2019-07-17 20:05:51"
"5d77277ad4d604665c5de592","active","Robert Franklin","Robert","Franklin","rfranklin66@gmail.com","8312385419",,5,"Great class that challenges you to think about what it takes to build great teams and organizations at scale or shall I say descale!","2019-09-28 08:47:31","2019-09-27 12:00:01",,"5cefef65f74a4e00a2b12fcf","XBA US/CAN - XSCALE Business Agility - Live Online Training Stream","Peter Merel",,"2019-09-10 14:33:01"
"5dd2f6c9e3392cf1df9c213c","active","Wouter Gheysen","Wouter","Gheysen","wouter@outofourminds.be","0493500562",,4,"The training was really great. Peter is a great storyteller and it nice listening to him. Sometimes is a bit hard to over see the whole course.","2019-12-23 00:01:25","2019-12-22 23:00:00","2020-05-30 00:00:19","5cf0a0195e4e8882a304aedf","XBA EU/UK/ANZ - XSCALE Business Agility - Live Online Training Stream( ANZ course times are 8-11pm Sundays and Saturdays)","Peter Merel",,"2019-11-19 06:53:47"
"5e3937e7844843bcd24def78","active","carla medway","carla","medway","c.medway@hotmail.com","0438491495",,5,"Just amazing, I think Peter is just amazing! i would love to be a coach, just not the right time for me.\nI have learnt so much from Peter and I can see why you do need some experience not just a 2 day course. \nlove it! keep it up Peter and team.","2020-03-27 12:22:30","2020-03-22 23:00:00",,"5df6f02b435fe87a62d041f6","XBA EU/UK/ANZ - XSCALE Business Agility - Live Online Training Stream( ANZ course times are 8-11pm Sundays and Saturdays)","Peter Merel",,"2020-02-04 20:22:51"